headline,url,summary
"Cops have been attacked, demonized by city councils in major cities: DC Police Union chair",https://www.foxnews.com/video/6265726088001,DC Police Union chairman Gregg Pemberton argues misguided legislation on law enforcement has resulted in more officers retiring nationwide
Gun control has shown throughout history 'it's racist': Antonia Okafor Cover,https://www.foxnews.com/video/6265397411001,"Atonia Okafor Cover, national spokesperson for Gun Owners of America, argues the U.S. should be 'pushing equality through the 2nd Amendment.'"
"Notable Quotables for Friday, July 23",https://www.foxnews.com/video/6264953429001,Bret Baier highlights the best soundbites from another memorable week in the news
"Fentanyl seizures at border skyrocket, 78 percent higher than 2020 fiscal year: CBP",https://www.foxnews.com/video/6264708641001,'Fox & Friends First' panel with reaction.
Rep. Zeldin explains what he believes are reasons for spike in NYC anti-Semitic attacks,https://www.foxnews.com/video/6264176638001,"Rep. Lee Zeldin, R-N.Y., GOP candidate for governor of New York, weighs in on the rise in Anti-Semitic attacks in New York City and reacts to outpacing Gov. Andrew Cuomo in the gubernatorial fundraising fight."
NYC man doused with caustic liquid in ambush attack caught on video,https://www.foxnews.com/video/6263560055001,Authorities are looking for a suspect caught on video dousing a man with liquid from behind
Ex-Minneapolis officer says crime surge 'seems to be out of control',https://www.foxnews.com/video/6263260194001,"Retired Minneapolis police officer Mylan Masson warns that while the city currently is not 'as bad' as Chicago, it 'certainly could be' unless the crime surge is addressed."
U. of Chicago student on peer who was killed by stray bullet: ‘Viciously and senselessly gunned down’,https://www.foxnews.com/video/6262853514001,"Audrey Unverferth discusses the death of Max Lewis, who was killed by a stray bullet while commuting home from an internship"
San Francisco DA official says crime surge fears are linked to racism,https://www.foxnews.com/video/6262556552001,A senior official in the San Francisco District Attorney's office links fears of a crime surge to racism; Fox News contributor Leo Terrell reacts.
"GOP to make border crisis, violent crime spike key issues in 2022 midterms",https://www.foxnews.com/video/6261912035001,'Next Revolution' host Steve Hilton explains why Republicans attacking Democrats on the border issue could be a smart strategy.
'The Five' react to White House blaming Republicans for defunding police,https://www.foxnews.com/video/6261598968001,Biden administration attempts to cast GOP as party who wants to cut police budgets; reaction on 'The Five'
Trey Gowdy: What use is any of our freedoms if you're dead,https://www.foxnews.com/video/6261298009001,'Sunday Night in America' host says the most important role of government is to keep Americans safe
Media top headlines June 25,https://www.foxnews.com/video/6260984904001,"Biden acting bizarre and whispering at a press conference, a Reuters survey showing that the US has the lowest levels of public trust in the media among 46 countries, and more round out today's top media headlines"
‘Taking away guns from law-abiding citizens is not the answer’ to rising crime: Nebraska governor,https://www.foxnews.com/video/6260642149001,Republican Governor Pete Ricketts urges Biden to recant ‘defund the police’ movement and not target legal gun owners ahead of anti-crime strategy announcement
"Tucker: This is America, not a 'third-world hell hole'",https://www.foxnews.com/video/6260036630001,'Tucker Carlson Tonight' host says rise in crime can be blamed on bad leadership across the country
"Father, son graduate Texas police academy together",https://www.foxnews.com/video/6259711390001,"Father-son police officers Winston and Christian Edmondson share their experience after graduating from the Lake Dallas, Texas police academy together"
Chicago alderman blasts city leaders for 'little accountability' amid spike in crime,https://www.foxnews.com/video/6259272268001,Chicago alderman Anthony Napolitano points out the exit rate in the city is 'astronomical right now' due to leadership.
Biden's $4B program for socially disadvantaged farmers halted by judge,https://www.foxnews.com/video/6258778597001,Dairy farmer Adam Faust files lawsuit and claims the president's race-based federal relief effort is 'racist.'
"Homicides skyrocket in Indianapolis as criminals break law while out on bail, wearing ankle bracelets",https://www.foxnews.com/video/6258199696001,'Fox & Friends' enterprise reporter Lawrence Jones sits down with family of Ashley Richardson who was killed by her ex-boyfriend while he was awaiting trial
"NYC sees weekend of violence, protests amid crime spike",https://www.foxnews.com/video/6257770072001,New York City sees weekend of gun violence and crime as NYPD on Saturday responds to park protest in riot gear. Fox News contributor Ted Williams calls on law enforcement to stop being depicted as 'the enemy of the people.'
How social media fuels anti-Semitism,https://www.foxnews.com/video/6256996767001,Journalist Eve Barlow on how social media and celebrities contribute to attacks on Jewish people amid the Israel-Hamas conflict
Biden's $6 trillion spending plan includes extensive tax hikes,https://www.foxnews.com/video/6256505209001,Fox News correspondent Mark Meredith has the latest from the White House on 'Special Report'
Motive remains a mystery in San Jose mass shooting,https://www.foxnews.com/video/6256166511001,Fox News correspondent Claudia Cowan joins 'Special Report' with the latest on the workplace massacre
'The Five' slam Dems ripping Israel amid rise in anti-Semitic attacks,https://www.foxnews.com/video/6255827221001,Sen. Bernie Sanders blasts aid to Israel saying America is 'supplying weapons of war to kill children;' 'The Five' react
Nancy Pelosi slammed for attending WH event without mask,https://www.foxnews.com/video/6255354426001,"House speaker panned for 'hypocrisy' for not wearing a face covering, while insisting on mask mandate inside the Capitol."
Gaetz associate to plead guilty to federal charges,https://www.foxnews.com/video/6254602570001,"Joel Greenberg, a former Seminole County official and an associate of Rep. Matt Gaetz, is expected to plead guilty to six federal charges and faces 12 years in prison. Gaetz has not been charged and denies all allegations."
Dan Bongino: Leftists believe stereotyping is OK when it comes to police,https://www.foxnews.com/video/6253511078001,Fox News contributor Dan Bongino reacts to the Times Square shooting involving a 4-year-old girl.
"New Orleans zoo cancels pro-police event, cites community concern",https://www.foxnews.com/video/6252808819001,FOX News contributor Raymond Arroyo joins 'The Ingraham Angle' for the latest edition of 'Seen and Unseen'
‘Where is the follow-up?’: Bongino slams “60 Minutes” for refusing to ask Blinken tough questions on border crisis,https://www.foxnews.com/video/6252065468001,Fox News contributor Dan Bongino discusses media coverage of Biden’s border policies and crime surges across major U.S. cities.
'It is significant' Brown shooting video is released right away: Ted Williams,https://www.foxnews.com/video/6250881758001,A judge could rule to order the release of body camera footage in the Andrew Brown Jr. case; Fox News contributor Ted Williams provides insight on ‘America’s Newsroom.’
Police officers being attacked in 'astounding numbers' and the blame is clear: Randy Sutton,https://www.foxnews.com/video/6250521155001,Former Las Vegas Police Lt. Randy Sutton addresses police officers around the country quitting amid a 'war on cops.'
"LeBron cop tweet 'reckless, dangerous': Fraternal Order of Police National VP",https://www.foxnews.com/video/6250023836001,Critics accuse the NBA All-Star of inciting violence. Fraternal Order of Police National Vice President weighs in on 'Fox & Friends.'
Dinesh D'Souza: Left's end goal is 'destruction of an institution',https://www.foxnews.com/video/6249765532001,Texas GOP Chairman Allen West and D'Souza react to left's push to convict US of 'systematic racism' on 'The Ingraham Angle'
Ted Williams refutes AOC: System worked exactly how it was supposed to,https://www.foxnews.com/video/6249592906001,'Fox News @ Night' panel discuss what to expect in the aftermath of the Derek Chauvin verdict
Minnesota state Sen. Osmek on push to penalize protesters,https://www.foxnews.com/video/6249471887001,State Sen. David Osmek on introducing bill that would prevent protesters who carry out criminal activity from receiving aid.
"San Antonio police officer shot in hand; 2 suspects dead, third injured",https://www.foxnews.com/video/6249204025001,"A San Antonio, Texas, police officer was shot in the hand before he killed two suspects and injured a third during a gunfire exchange, authorities said."
Los Angeles County DA facing ‘no confidence’ backlash,https://www.foxnews.com/video/6249060484001,Pico Rivera becomes third county community to oppose District Attorney George Gascón's liberal policies. Councilman Andrew Lara reacts.
Washington DC protesters chant 'burn the precinct to the ground',https://www.foxnews.com/video/6248911751001,Chant heard during demonstrations following Daunte Wright's death
McEnany on Minnesota shooting: Officer deserves 'due process and fairness',https://www.foxnews.com/video/6248681651001,Former White House press secretary discusses the Daunte Wright shooting on 'The Story'
"Honk for Justice, or else",https://www.foxnews.com/video/6246672309001,"Amid the trial of Derek Chauvin in Minneapolis, Black Lives Matter activists take to the streets."
Derek Chauvin trial includes graphic bodycam footage of George Floyd's death,https://www.foxnews.com/video/6245833603001,FOX News national correspondent Matt Finn joins 'Special Report' with the details from Minneapolis
We’re helping diverse communities achieve the American Dream: ASIAN Inc. president,https://www.foxnews.com/video/6244845074001,Lamar Heystek on anti-Asian hate in America
