headline,url,summary
San Francisco voters want 'justice back to our streets’,https://www.foxnews.com/video/6307447047112,The Wounded Blue founder Lt. Randy Sutton on how law enforcement has reacted to the recall of liberal San Francisco D.A.
Concern for judges' safety grows following 'targeted attack' in Wisconsin,https://www.foxnews.com/video/6307364330112,Constitutional law attorney Jonathan Turley discusses the growing calls for stronger judicial protections and provides analysis of the trial of Clinton campaign lawyer Michael Sussmann.
Bill Bennett on teen drug overdose deaths: Federal government needs to ‘act against’ cartels,https://www.foxnews.com/video/6307258500112,Former Education Secretary Bill Bennett joins ‘America’s Newsroom’ to provide insight into the teenage overdose death rate rising.
NYPD searching for several suspects who opened fire in Coney Island,https://www.foxnews.com/video/6307140433112,"At least five people brandished firearms and 36 rounds were fired in a broad daylight shooting on Sunday in Brooklyn, according to the NYPD."
DOJ investigating Texas school shooting as community members demand action from Biden,https://www.foxnews.com/video/6307004703112,Rep. Mariannette Miller-Meeks suggests possible solutions to prevent future mass shootings and shares her message for Memorial Day.
Gregg Jarrett on Michael Sussmann trial: This is the worst jury for a prosecutor,https://www.foxnews.com/video/6306950860112,Fox News legal analyst Gregg Jarrett and attorney for former President Trump Alina Habba deliberate the fate of Hillary Clinton's campaign lawyer.
Police need to be better trained on how to react in these situations: Dan Linskey,https://www.foxnews.com/video/6306897651112,Former Boston Police superintendent-in-chief Dan Linskey on how police responded to the Uvalde school shooting.
Lawmakers debate child safety in school classrooms after Texas school shooting,https://www.foxnews.com/video/6306866423112,"Fox News congressional correspondent Chad Pergram has the latest as lawmakers from both sides of the aisle are on edge after this week's school shooting in Uvalde, Texas."
Democrats see Uvalde shooting as a political asset: Miranda Devine,https://www.foxnews.com/video/6306841128112,Fox News contributor Miranda Devine argues Democrats are not interested in keeping children safe or prohibiting another mass shooting. She also discusses the trial of former Clinton campaign lawyer Michael Sussmann.
Watters calls for change following the tragedy in Texas,https://www.foxnews.com/video/6306820187112,"Fox News host Jesse Watters weighs in on the Uvalde, Texas, school shooting that left 19 children, 3 adults, including shooter dead on 'Jesse Watters Primetime.'"
Texas school shooter's grandmother will be key to investigation: DPS,https://www.foxnews.com/video/6306783445112,"Texas DPS officer Lt. Chris Olivarez on the investigation into the school shooting at Robb Elementary in Uvalde, Texas"
"Following school shooting, Officials have to ponder what can be done differently: Harold Ford Jr.",https://www.foxnews.com/video/6306753835112,"Ari Fleischer, Harold Ford Jr. and Mollie Hemingway react to the elementary school shooting in Texas on 'Special Report.'"
Sussmann defense calling Clinton aide Mook to testify was 'foolish': Jarrett,https://www.foxnews.com/video/6306563885112,Fox News legal analyst Gregg Jarrett breaks down Robby Mook's testimony in the Trump-Russia trial on 'Hannity.'
"Buffalo shooting suspect pleaded not guilty, faces life in prison without parole",https://www.foxnews.com/video/6306267280112,Fox News' Nate Foy and Bill Hemmer provide details about Buffalo shooting suspect Payton Gendron and two of the victims.
"Intimidation tactics should be ‘condemned’ by White House, DOJ: Sen. Johnson",https://www.foxnews.com/video/6306148389112,"Sen. Ron Johnson, R-Wis., details his letter to the Biden administration asking to condemn mobs and violent protests at private properties."
George Gascón recall effort surges past 400K signatures,https://www.foxnews.com/video/6305905335112,Recall Gascón campaign spokesman Tim Lineberger says the LA district attorney is the most despised local politician in California on 'Fox & Friends Weekend.'
Dave Chappelle’s alleged attacker makes first court appearance,https://www.foxnews.com/video/6305729859112,Suspect Isaiah Lee entered a not guilty plea on Friday
Streaming now on Fox Nation: Who is Johnny Depp?,https://www.foxnews.com/video/6305560530112,"Eccentricity and darkness are at the heart of Hollywood icon Johnny Depp's acting persona, but what about when the cameras aren't rolling?"
14-year old suspect arrested for the murder of Lily Peters,https://www.foxnews.com/video/6305325321112,Former federal prosecutor Francey Hakes on the murder case of 10-year old Lily Peters and why she believes this tragedy was preventable.
Chicago police recruit Marines to help solve policing problems,https://www.foxnews.com/video/6305048423001,Chicago Police Foundation Chairman Rick Simon shares the reasons behind Chicago police recruiting Marines to help solve the city's crime problem.
Suspect arrested in murder of Queens mom,https://www.foxnews.com/video/6304643452001,Fox News' Bryan Llenas provides details after NYPD officials confirmed David Bonola was arrested and charged with Orsolya Gaal's murder.
Wilkinsburg police arrest protester,https://www.foxnews.com/video/6304320185001,"Wilkinsburg police arrest a protestor during a rally for Jim Rogers, a homeless man tased to death by police officers."
Black Lives Matter helps nobody except themselves: Tyrus,https://www.foxnews.com/video/6304075514001,'The Five' reacts to NYC Mayor Eric Adams calling out BLM to address crime.
Tucker: Who is Frank James?,https://www.foxnews.com/video/6303866806001,Fox News host reacts to the Brooklyn subway shooting on 'Tucker Carlson Tonight.'
Former NYPD officer: Complacency is our enemy,https://www.foxnews.com/video/6303747642001,Ret. NYPD Officer Bill Stanton reacts to the Brooklyn train shooting on 'Jesse Watters Primetime.'
Sacramento sheriff blasts liberal 'soft-on-crime' policies: Doing nothing to stop criminals,https://www.foxnews.com/video/6303691921001,Sacramento County Sheriff Scott Jones says he's running for Congress to tackle progressive policies that he argues treat criminals like the victim.
Parkland trial: Prospective Nikolas Cruz sentencing juror says she can't be on jury because of 'sugar daddy',https://www.foxnews.com/video/6303132638001,Circuit Judge Elizabeth Scherer dismissed a potential juror for the sentencing of Parkland school shooter Nikolas Cruz after she claimed she didn’t have enough time to fulfill her civic duty because she’s both married and has “a sugar daddy.”
Police officers slam liberal policies that resulted in rise in crime,https://www.foxnews.com/video/6302540568001,"President of Chicage FOP John Catanzara, Jr. and retired NYPD Detective Angel Maysonet respond to the rise in violent crimes occurring in their cities and a new poll showing pro-police candidates are the most popular."
Miami Beach Hotelier Mitch Novick discusses impact of city's state of emergency declared over spring break,https://www.foxnews.com/video/6301974502001,Miami Hotelier Mitch Novick spoke with Fox News about how the order is impacting business owners like him
Gutfeld: Here's why progressives 'deny' crime,https://www.foxnews.com/video/6301127734001,'The Five' panelists weigh in on the soaring crime waves in San Francisco and across the nation.
Ingraham: High gas price-induced self-restrictions are 'Biden's new lockdown',https://www.foxnews.com/media/ingraham-angle-gas-crisis-biden-new-lockdown-covid-jimmy-carter,"In her ""Ingraham Angle"" commentary on Wednesday, host Laura Ingraham explained how, with the federal coronavirus emergency subsiding, President Biden and his administration need a new way to lock down the populace and keep them in their control."
Kyiv resident raced family to safety after Russian attack: 'Normal life is gone',https://www.foxnews.com/video/6299184393001,Former Ukraine First Deputy Minister of Economy Max Nefyadov describes the situation on the ground in the Ukraine capital on 'America Reports.'
Fare Evader Gets Caught,https://www.foxnews.com/video/6298536164001,Fare evader gets caught at Herald Square. Video credit: Steven Hirsch for Fox News Digital
Eric Shawn: A plea to politicians from a mother whose son was murdered by a 17-year-old,https://www.foxnews.com/video/6298173959001,Donna Nolan blames bail reform for letting killers out... and tells New York state leaders they need to stop helping criminals.
Girl missing since 2019 found alive under staircase,https://www.foxnews.com/video/6297813779001,Fox Nation host Nancy Grace sounds off on the abduction case.
"VA Lt. Gov. Sears on mask mandates, Biden's search for Supreme Court Justice",https://www.foxnews.com/video/6297297576001,"Winsome Sears weighs in on Biden's plan to pick a Black woman for the Supreme Court, noting that she hopes that the president will choose a judge who respects the Constitution, will uphold the law, judge fairly and not be partisan."
Chicago teachers slam Lightfoot after mayor blames remote learning for rise in carjacking crimes,https://www.foxnews.com/video/6296563891001,The Chicago Teachers Union responded after Chicago Mayor Lori Lightfoot said there was a correlation between remote learning and a rise in car thefts involving juveniles.
Study indicates fentanyl deaths doubled in 30 states amid border crisis,https://www.foxnews.com/video/6296056621001,Fox News medical contributor Dr. Marc Siegel joined 'Fox & Friends First' to discuss the number of fentanyl deaths spiking in over two dozen states amid the border crisis.
Another Biden nominee exposed as far-left radical,https://www.foxnews.com/video/6295342468001,Chuck Devore tells Laura Ingraham that Federal Vice Chair nominee Sarah Bloom Raskin is proposing to use the awesome power of regulatory rules of unelected bureaucrats to do things that Congress hasn’t even wanted to do.
"Police need to be ‘invested’ in, not defunded: Rep. Gottheimer",https://www.foxnews.com/video/6294972170001,"Rep. Josh Gottheimer, D-N.J., joins ‘America’s Newsroom’ to provide insight into Democrats pushing for a police funding bill."
"As homicides spike in U.S. cities, a New Orleans church remembers victims with a ""murder board""",https://www.foxnews.com/video/6294696141001,"Hundreds of more Americans are being killed in the streets of big cities. A ""murder board"" that stands outside a church in New Orleans tells the story of over a decade's worth or murders in South Louisiana."
Officer Jason River mourned at St. Patrick's Cathedral funeral,https://www.foxnews.com/video/6294230295001,Fox News correspondent Bryan Llenas has the details on 'America Reports.'
"California burglars smash storefront with car, steal cash and jewelry",https://www.foxnews.com/video/6294011783001,"Two masked men looted a jewelry business in Escondido, California, after ramming the storefront with what police say was a stolen vehicle."
NYC Mayor Adams announces new plan to combat crime,https://www.foxnews.com/video/6293522050001,Retired NYPD Detective Angel Maysonet urges Mayor Adams and DA Bragg to focus on holding criminals accountable.
"Eric Shawn: No cops, no jails... NYC council member has demanded",https://www.foxnews.com/video/6293110775001,"Former NYPD Commissioner Ray Kelly on council member Kristin Richardson Jordan, who represents Harlem district where deadly police ambush took place, who wants NYPD abolished"
Baby in critical condition after Bronx gun fight,https://www.foxnews.com/video/6292747377001,"An 11-month-old baby girl was shot in the face while sitting in a parked car in the Bronx, police said; Bryan Llenas reports on the latest."
Elected officials took a hands-off approach to public safety: LAPD officer,https://www.foxnews.com/video/6292441473001,Deon Joseph urges officials to stop making police the enemy and invest in crime control on ‘The Story.’
North Carolina police release bodycam video showing aftermath of Jason Walker shooting,https://www.foxnews.com/video/6292114752001,The Fayetteville Police Department released some body camera footage in the interest of transparency after the shooting of a Black man by an off-duty Cumberland County deputy.
"Graphic content warning: Woman brutally beaten, stabbed in caught-on-camera NYC attack",https://www.foxnews.com/video/6291790111001,"Police are looking for two men seen on video repeatedly punching, kicking and stabbing a young woman in the Bronx, NY."
Manhattan DA Bragg is ‘Trojan horse’ and enemy of public safety: Law enforcement veteran,https://www.foxnews.com/video/6291255688001,Wounded Blue Founder Lieutenant Randy Sutton reacts to Manhattan District Attorney Alvin Bragg defending his crime policies.
Supreme Court set to review Biden mandates,https://www.foxnews.com/video/6290378883001,Senior national correspondent Rich Edson highlights the vaccine mandate debate and what to expect as the Supreme Court gears up to hear oral arguments.
Progressive policing behind rising crime: Horace Cooper,https://www.foxnews.com/video/6289921466001,The Project 21 co-chair and Democratic strategist Kevin Walling discuss and diagnose record homicide rates in 2021 on 'Fox News @ Night.'
Two men indicted by Durham will go on trial in 2022,https://www.foxnews.com/video/6289305145001,Former Federal Prosecutor James Trusty details what to expect in 2022 as two men have been indicted as a result of the Durham probe into the roots of the Trump-Russia investigation
Pastor Corey Brooks hired former gangsters for violence prevention mission in Chicago,https://www.foxnews.com/video/6288940268001,"The pastor and host of 'Rooftop Revelations,' a 100-day vigil to raise funds for a community center, discusses how he works to save one life at a time in Chicago on 'Hannity.'"
Outcome reached in Kim Potter trial,https://www.foxnews.com/video/6288356541001,Criminal defense attorney Mark Eiglarsh explains that an 'outcome' doesn't necessarily mean jurors have reached a verdict and discusses the next steps if the jury is hung.
Mississippi town cancels Christmas parade as shooting rise,https://www.foxnews.com/video/6287977000001,"Crawford, Mississippi Mayor Willie Parson says she did not want any violent incidents like what happened in Waukesha, Wisconsin."
"Biden, White House don't address real issues on crime: former Detroit police chief",https://www.foxnews.com/video/6287388506001,James Craig lays the nationwide crime wave at the feet of certain key Democrats on ‘Your World.’
"Americans want change, strong leadership as crime soars: Former Detroit police chief",https://www.foxnews.com/video/6286990654001,GOP Michigan gubernatorial candidate James Craig joined 'The Faulkner Focus' to discuss brazen crime across the country as the number of murders breaks records in Chicago and Philadelphia.
"Manhattan Institute fellow slams Mayor de Blasio over misleading crime statistic, dismissing NYC violence spike",https://www.foxnews.com/video/6286611146001,Rafael Mangual reacts to the New York City mayor’s dismissal of crime in the Big Apple.
Concha: Liberal media wanted to believe Jussie Smollett,https://www.foxnews.com/video/6286158698001,Fox News contributor Joe Concha says liberal media pushed Smollett's original story because they 'wanted to believe it.' He also slams President Biden's 'scripted presidency' after he appeared to read a teleprompter cue out loud.
California GOP chair: 'People in this state want law and order',https://www.foxnews.com/video/6285949822001,California Republican Party chairwoman Jessica Millan Patterson on why the rise in crime is a direct result of Democratic leadership.
Jack Brewer slams Jussie Smollett for using race to divide: It's 'unbelievable' people are supporting him,https://www.foxnews.com/video/6285771244001,"The Brewer Group CEO, Jack Brewer, joined 'Fox & Friends First' to discuss the Jussie Smollett case."
Eric Shawn: A call for a Jewish civil rights movement,https://www.foxnews.com/video/6285337392001,The Lawfare Project executive director Brooke Goldstein on the shocking rise of anti-Semitic attacks in America
Michigan school shooting suspect's parents face involuntary manslaughter charges,https://www.foxnews.com/video/6285061593001,Prosecutor details allegations surrounding Ethan Crumbley's parents
San Francisco business owner on struggle to afford private security: 'It's just not feasible',https://www.foxnews.com/video/6284683743001,CrossFit Golden Gate Gym Owner Danielle Rabkin joined 'Fox & Friends' to discuss the crime wave and how it is impacting business owners in the city.
NYC man arrested 3 times in 36 hours as Democrats face backlash over bail reform,https://www.foxnews.com/video/6284353829001,The homeless man reportedly boasted to police about being released.
Ahmaud Arbery verdict 'a big victory for race relations': Brian Claypool,https://www.foxnews.com/video/6283679984001,The criminal defense attorney discussed the Ahmaud Arbery homicide trial guilty verdict with retired police lieutenant Randy Sutton on 'Fox News @ Night'
Democrat slams radical dems: 'These elected officials should be arrested for negligence',https://www.foxnews.com/video/6283540580001,"Former New York State Assemblyman Dov Hikind (D) on AOC and other members of the squad pushing for bail reform following the Waukesha tragedy, arguing that 'they are responsible for caring more about criminals than they care about citizens'"
Media top headlines November 23,https://www.foxnews.com/video/6283391092001,"In media news today, NBC suggests not having Thanksgiving this year, CBS' 'Face the Nation' corrects claim Rittenhouse crossed state lines while armed, and more"
Father of NYC shooting victim urges officials to crack down on crime,https://www.foxnews.com/video/6283282637001,Jason Williams speaks out on the family’s ‘pain and suffering’ in the year following Ethan Williams’ murder in New York City.
"Haitian gang releases 2 Christian missionaries held hostage, 15 still being held",https://www.foxnews.com/us/christian-missionary-group-announces-two-hostages-released-from-haiti,A Christian missionary group announced that two of its 17 missionaries have been released after being held hostage by a Hatian gang.
Leo Terrell blasts de Blasio over response to Rittenhouse verdict,https://www.foxnews.com/video/6282823039001,Civil rights attorney Leo Terrell offers analysis on 'The Story'
"What MSNBC did to Rittenhouse jurors is 'very wrong,' should be punished: Attorney",https://www.foxnews.com/video/6282639907001,Criminal defense attorney Mark Eiglarsh reacts to allegations a MSNBC freelancer followed a bus transporting the Kyle Rittenhouse jury.
California prosecutors push for drug dealers to face murder charges for overdose deaths,https://www.foxnews.com/video/6282432180001,"Fox News' Christina Coleman reports the latest on the effort from Los Angeles, California."
Team of incompetents,https://www.foxnews.com/video/6282180771001,The lightweights behind Biden are wreaking havoc on our lives
BLM leader threatens 'bloodshed' if undercover police return to NYC,https://www.foxnews.com/video/6281726414001,Fox News correspondent Bryan Llenas has the details from New York City on 'Special Report.'
EXCLUSIVE: Spokesperson for Kyle Rittenhouse talks to Laura Ingraham,https://www.foxnews.com/video/6281392445001,Rittenhouse Spokesperson: Media doesn’t want to know the facts because then they have to say the truth.
Texas 19-year-old with special needs dies after fatal prison attack,https://www.foxnews.com/video/6280322855001,"A 19-year-old inmate with special needs at the Harris County Jail has died after allegedly being brutally attacked by another inmate, according to his family's attorney."
Hate crimes on the rise in America’s houses of worship,https://www.foxnews.com/video/6279700588001,Theologian Russell Moore urges Americans to stand up to ‘hatred and violence’ against all religions on ‘Sunday Night in America.’
Texas police reveal 'heartbreaking' details of abused kids living alone with dead brother: 'Horrific',https://www.foxnews.com/us/texas-police-horrific-details-corpse-boy-brothers-alone-apartment,The Texas sheriff's office investigating the murder of an 8-year-old boy who was left to decay in an apartment revealed has released new details on the “horrific” case.
Nancy Grace: Details surrounding Brian Laundrie's remains are 'all very vague in my mind',https://www.foxnews.com/video/6278661222001,Watch 'A Gabby Petitio Investigation with Nancy Grace Part 2' exclusively on Fox Nation
Rand Paul: Lightfoot’s vaccine mandate is a disservice to our first responders,https://www.foxnews.com/video/6278062041001,Kentucky senator sounds off on Chicago’s mandates causing the city to prepare for possible police shortage.
Former police sergeant reacts to deadly officer shooting in Houston: 'We have to do something about this',https://www.foxnews.com/video/6277548557001,"Congressional candidate in Texas, Tre Pennie, argued electing the right politicians is key to counteract anti-police rhetoric."
Family of slain woman slams judge for releasing suspect,https://www.foxnews.com/video/6277053329001,"Andrew Williams had been out on bond stemming from another capital murder case, report says"
Mother demands more NYC cops: Gun violence should not be end of child's life,https://www.foxnews.com/video/6276714934001,"Eve Hendricks, who lost 17-year-old son to a shooting, on the fight for safer streets in New York City."
"Brian Laundrie 'needs to turn himself in,' can’t ‘hide forever,' ex-fugitive says",https://www.foxnews.com/video/6276147040001,Ex-convict-turned-writer-and-producer Seth Ferranti on the search for Gabby Petito's fiancé.
Biden 'wrong' when blaming Republicans for 'his failings': Rep. Comer,https://www.foxnews.com/video/6275621828001,"The president pointing fingers at Republicans, moderate Democrats for his agenda and debt ceiling woes. Rep. James Comer, R-Ky., with reaction on 'Fox & Friends First.'"
Appalachian Trail hiker claims he saw Brian Laundrie in Tennessee,https://www.foxnews.com/video/6275361612001,A Florida man hiking the Appalachian Trail claims he saw Brian Laundrie driving in a white pickup truck around 12:30 a.m. ET on Saturday in Tennessee near the North Carolina border.
Lawrence Jones takes an inside look into Idaho's fentanyl crisis,https://www.foxnews.com/video/6274925781001,Fox News enterprise reporter Lawrence Jones goes to Idaho while state sees a massive increase in fentanyl overdose deaths
Philadelphia sees over 400 homicides so far in 2021,https://www.foxnews.com/video/6274564751001,Criminal justice attorney Bill Brennan says the violence in the City of Brotherly Love is a crisis.
Virginia police officer works to keep historic battlefield preserved,https://www.foxnews.com/video/6274298808001,Lt. Damon Radcliffe shares his family's story and where the origins of his bravery come from
Indiana law enforcement fights back against Chicago criminals,https://www.foxnews.com/video/6273864853001,Officers use high-tech solutions to catch suspects across Illinois-Indiana border
911 call reveals Laundrie hit Petito during August dispute,https://www.foxnews.com/video/6273549978001,Former New York City Administration for Children's Services acting chief Ed Gavin believes police 'dropped the ball' on protecting Gabby Petito.
Abused gymnasts spark outrage,https://www.foxnews.com/video/6273272639001,Media pounce on FBI failures
Fentanyl seizures at border up 34% in a year,https://www.foxnews.com/video/6272826280001,"Rep. Diana Harshbarger, R-Tenn., addresses border crisis, says agents have seized 'unimaginable' amounts of fentanyl"
Retired NYPD officers reflect on working at Ground Zero 20 years ago,https://www.foxnews.com/video/6271902995001,"NYPD former Detective Oscar Odom, retired Detective Angel Maysonet and former Lt. Darrin Porcher share their 9/11 experiences on 'Fox & Friends First.'"
Clay Travis: 'We don't want teachers turning students into far left-wing zealots',https://www.foxnews.com/video/6270488977001,"Outkick's Clay Travis rips teacher for promoting Antifa in classroom, says this is happening around the country"
Harsh media sendoff for Cuomo,https://www.foxnews.com/video/6268050634001,Once-adoring press pans resignation speech
Dems may move to impeach Cuomo following resignation,https://www.foxnews.com/video/6267486876001,National correspondent Bryan Llenas reports on the latest surrounding New York governor Andrew Cuomo's resignation.
Britney Spears' dad argues 'no grounds' for conservatorship removal,https://www.foxnews.com/video/6267031483001,Attorney Janine Atamian on the latest developments in Britney Spears' conservatorship case
Father of murdered SC college student speaks out after man receives life sentence,https://www.foxnews.com/video/6266650896001,"Seymour Josephson, whose daughter Samantha was abducted and murdered after getting into a car she thought was an Uber, says it's a 'relief' her killer 'won't be able to do this again.'"
Gov. Cuomo's denial shows he 'does not want to leave office': Leo Terrell,https://www.foxnews.com/video/6266402891001,Civil rights attorney Leo Terrell explains the implications of New York governor Andrew Cuomo’s response to AG findings.
Criminals don't care about social programs they care about committing crimes: Safir,https://www.foxnews.com/video/6266131798001,Former NYC police Commissioner Howard Safir warns the country is going back to the 'bad old days' with latest policing measures
